[{
  "_id": "HS-ESS1-2",
  "discipline": "Earth and Space Science",
  "topic": "Earth’s Place in the Universe",
  "subTopic": "Earth and the Solar System",
  "description": "This virtual science lab uses the My Solar System Lab Simulation app to explore the dynamics of the solar system. Students will engage in a case-study method to investigate the relationships between mass, distance, and gravitational forces in planetary motion.",
  "learningGoals": {
    "bigIdea": "The gravitational interactions between celestial bodies govern the structure and behavior of the solar system.",
    "objectives": [
      "Understand how mass and distance affect gravitational forces.",
      "Analyze the relationship between orbital speed and distance from the sun.",
      "Investigate how changes in mass impact orbital dynamics.",
      "Explore the interactions of multiple bodies within the solar system."
    ],
    "successCriteria": [
      "Demonstrate the ability to manipulate simulation parameters effectively.",
      "Accurately document observations and data collected during the simulation.",
      "Make informed predictions based on scientific reasoning.",
      "Engage in critical thinking about the relationships and dynamics within the solar system."
    ]
  },
  "labParts": [
    {
      "partId": 1,
      "title": "Investigating Gravitational Forces",
      "setup": [
        "Open the My Solar System Lab Simulation app.",
        "Set the mass of the sun to 250.0 (10^28 kg) and the mass of a planet to 25.0 (10^28 kg).",
        "Adjust the distance between the sun and the planet to 1 AU.",
        "Start the simulation and observe the motion."
      ],
      "observations": [
        "How does the planet's orbit change as you adjust its mass?",
        "What happens to the gravitational force as the distance between the sun and the planet is altered?",
        "How does the planet's speed change in relation to its distance from the sun?"
      ],
      "evidence": [
        "Document the gravitational force and orbital speed in a CSV file."
      ],
      "predictions": [
        "What will happen to the planet's orbit if its mass is increased?",
        "How will the gravitational force change if the distance is doubled?"
      ]
    },
    {
      "partId": 2,
      "title": "Effect of Distance on Orbital Speed",
      "setup": [
        "Reset the simulation.",
        "Keep the mass of the sun at 250.0 (10^28 kg) and the mass of the planet at 25.0 (10^28 kg).",
        "Set the distance to 2 AU and start the simulation.",
        "Record the planet's orbital speed."
      ],
      "observations": [
        "What differences do you notice in the planet's speed at 2 AU compared to 1 AU?",
        "How does the gravitational pull affect the planet's speed at this distance?",
        "Does the planet maintain a consistent speed throughout its orbit?"
      ],
      "evidence": [
        "Record the planet's orbital speed at both distances in a CSV file."
      ],
      "predictions": [
        "How will the orbital speed change if the distance is increased to 3 AU?",
        "What do you think will happen if the distance is decreased to 0.5 AU?"
      ]
    },
    {
      "partId": 3,
      "title": "Mass and Orbital Dynamics",
      "setup": [
        "Reset the simulation.",
        "Set the mass of the sun to 250.0 (10^28 kg).",
        "Set the mass of the planet to 50.0 (10^28 kg).",
        "Maintain the distance at 1 AU and start the simulation."
      ],
      "observations": [
        "How does the increased mass of the planet affect its orbit?",
        "What changes do you observe in the gravitational force exerted on the planet?",
        "How does this mass change impact the planet's speed?"
      ],
      "evidence": [
        "Document the gravitational force and orbital speed in a CSV file."
      ],
      "predictions": [
        "How might the planet's orbit change if its mass were decreased to 10.0 (10^28 kg)?",
        "What would happen if both the sun and planet masses were increased simultaneously?"
      ]
    },
    {
      "partId": 4,
      "title": "Exploring Multiple Bodies in the System",
      "setup": [
        "Reset the simulation.",
        "Set the mass of the sun to 250.0 (10^28 kg).",
        "Set the mass of two planets: one at 25.0 (10^28 kg) and another at 10.0 (10^28 kg).",
        "Set the distances to 1 AU and 1.5 AU respectively, then start the simulation."
      ],
      "observations": [
        "How do the orbits of the two planets interact with each other?",
        "What happens to the gravitational forces acting on each planet?",
        "How do the speeds of the planets compare to each other?"
      ],
      "evidence": [
        "Collect data on the orbits and speeds of both planets in a CSV file."
      ],
      "predictions": [
        "What will happen if the distance between the two planets is reduced?",
        "How might the orbits change if one planet's mass is significantly increased?"
      ]
    }
  ],
  "_class": "edu.regis.stemulator.model.ScienceLab"
},
{
  "_id": "HS-LS4-2",
  "discipline": "Life Science",
  "topic": "Biological Evolution: Unity and Diversity",
  "subTopic": "Natural Selection",
  "description": "This virtual science lab explores the principles of natural selection through a simulation that allows students to manipulate variables affecting a rabbit and wolf ecosystem.",
  "learningGoals": {
    "bigIdea": "Natural selection is a key mechanism of evolution that leads to changes in populations over time.",
    "objectives": [
      "Understand the concept of natural selection.",
      "Analyze how environmental changes affect species survival.",
      "Explore the role of mutations in evolution.",
      "Evaluate data to draw conclusions about evolutionary processes."
    ],
    "successCriteria": [
      "Students can explain the process of natural selection.",
      "Students can identify how environmental factors influence species.",
      "Students can describe the impact of mutations on populations.",
      "Students can effectively analyze and present data from simulations."
    ]
  },
  "labParts": [
    {
      "partId": 1,
      "title": "Introduction to Natural Selection",
      "setup": [
        "Open the Natural Selection Lab Simulation app.",
        "Select the 'Introduction to Natural Selection' module.",
        "Set the initial conditions: Habitat to 'Desert', Wolves to 'Few', Food Supply to 'Normal', and Mutation Rate to '10%'."
      ],
      "observations": [
        "What is the initial population of rabbits and wolves?",
        "How do the rabbits and wolves interact in the ecosystem?",
        "What traits do the rabbits exhibit in terms of speed and camouflage?"
      ],
      "evidence": [
        "Document the population data of rabbits and wolves in a CSV file after each generation."
      ],
      "predictions": [
        "How will the population of rabbits change over several generations?",
        "What traits will become more common in the rabbit population as the simulation progresses?"
      ]
    },
    {
      "partId": 2,
      "title": "Simulating Environmental Changes",
      "setup": [
        "Change the Habitat to 'Forest'.",
        "Keep the Wolves at 'Few', Food Supply at 'Normal', and Mutation Rate at '10%'.",
        "Run the simulation for 10 generations."
      ],
      "observations": [
        "How does the change in habitat affect the rabbit population?",
        "What differences do you notice in the traits of rabbits compared to the desert habitat?",
        "How do the wolves adapt to the new environment?"
      ],
      "evidence": [
        "Document the average traits of rabbits in a CSV file after 10 generations."
      ],
      "predictions": [
        "What will happen to the rabbit population if the wolves remain few?",
        "Will the traits of the rabbits change significantly in this new habitat?"
      ]
    },
    {
      "partId": 3,
      "title": "Exploring Mutations and Variation",
      "setup": [
        "Set the Mutation Rate to '30%'.",
        "Keep the Habitat as 'Desert', Wolves as 'Few', and Food Supply as 'Normal'.",
        "Run the simulation for 10 generations."
      ],
      "observations": [
        "What new traits appear in the rabbit population due to increased mutation?",
        "How does the population size of rabbits change with higher mutation rates?",
        "Are there any traits that seem to provide a survival advantage?"
      ],
      "evidence": [
        "Document the population changes and traits in a CSV file after 10 generations."
      ],
      "predictions": [
        "How will the increased mutation rate affect the overall fitness of the rabbit population?",
        "Will the wolf population be affected by the changes in rabbit traits?"
      ]
    },
    {
      "partId": 4,
      "title": "Analyzing Data and Formulating Conclusions",
      "setup": [
        "Review the data collected from previous simulations.",
        "Compare the population sizes and traits across different habitats and mutation rates.",
        "Prepare to present your findings."
      ],
      "observations": [
        "What patterns do you notice in the data regarding population changes?",
        "How do different environmental factors influence natural selection?",
        "What conclusions can you draw about the relationship between traits and survival?"
      ],
      "evidence": [
        "Compile a summary of your findings and conclusions in a CSV file."
      ],
      "predictions": [
        "What might happen if the environmental conditions change drastically?",
        "How could these findings apply to real-world ecosystems?"
      ]
    }
  ],
  "_class": "edu.regis.stemulator.model.ScienceLab"
}]